{"task_id":"FIX-043","timestamp":1778624000,"trace_id":"6921f6eb-6f55-42c8-8d57-16f6f9f750d5","goal":"#18 Final: useAI hook test + AIService fetch mock","files_to_modify":["D:\\projects\\alkaid\\src\\renderer\\services\\__tests__\\ai.test.ts","D:\\projects\\alkaid\\src\\main\\services\\__tests__\\ai.test.ts"],"constraints":["typescript.md","react.md"],"hooks":{"pre_task":[],"post_task":[]},"verification":["bun run typecheck","bun run test -- --coverage"],"coverage_checklist":{"use_ai_tested":"assert:renderer useAI测试通过","ai_service_fetch":"assert:main AIService fetch mock测试","all_pass":"assert:全部通过"},"status":"pending"}