{"task_id":"FIX-041","timestamp":1778622500,"trace_id":"6921f6eb-6f55-42c8-8d57-16f6f9f750d5","goal":"#18 Iter6: Settings + App + Home 页面测试","files_to_modify":["D:\\projects\\alkaid\\src\\renderer\\pages\\__tests__\\Settings.test.tsx","D:\\projects\\alkaid\\src\\renderer\\__tests__\\App.test.tsx","D:\\projects\\alkaid\\src\\renderer\\pages\\__tests__\\Home.test.tsx"],"constraints":["react.md"],"hooks":{"pre_task":[],"post_task":[]},"verification":["bun run typecheck","bun run test"],"coverage_checklist":{"all_pass":"assert: 所有测试通过"},"status":"pending"}