{"task_id":"FIX-039","timestamp":1778621500,"trace_id":"6921f6eb-6f55-42c8-8d57-16f6f9f750d5","goal":"#18 Iter4: About + Welcome page tests","files_to_modify":["D:\\projects\\alkaid\\src\\renderer\\pages\\__tests__\\About.test.tsx","D:\\projects\\alkaid\\src\\renderer\\pages\\__tests__\\Welcome.test.tsx"],"constraints":["react.md"],"hooks":{"pre_task":[],"post_task":[]},"verification":["bun run typecheck","bun run test"],"coverage_checklist":{"about_renders":"assert: About page renders","welcome_renders":"assert: Welcome page renders"},"status":"pending" }